{
  "schema": "openminer-diagram-v1",
  "kind": "packet",
  "title": "BM2382 work packet",
  "description": "BM2382 work packet. CRC16 covers bytes 2\u201351 and is stored high byte first at bytes 52\u201353. Seed = (2 \u00d7 (ID + 1)) & 255. Use the documented two-chain dispatch policy.",
  "unit": "byte",
  "width": 54,
  "numbering": "zero-based wire offset",
  "fields": [
    {
      "offset": 0,
      "width": 1,
      "label": "55",
      "status": "known"
    },
    {
      "offset": 1,
      "width": 1,
      "label": "aa",
      "status": "known"
    },
    {
      "offset": 2,
      "width": 1,
      "label": "30",
      "status": "known"
    },
    {
      "offset": 3,
      "width": 1,
      "label": "ID",
      "status": "known"
    },
    {
      "offset": 4,
      "width": 8,
      "label": "Timestamp",
      "status": "known"
    },
    {
      "offset": 12,
      "width": 8,
      "label": "Word 0",
      "status": "known"
    },
    {
      "offset": 20,
      "width": 8,
      "label": "Word 1",
      "status": "known"
    },
    {
      "offset": 28,
      "width": 8,
      "label": "Word 2",
      "status": "known"
    },
    {
      "offset": 36,
      "width": 8,
      "label": "Word 3",
      "status": "known"
    },
    {
      "offset": 44,
      "width": 2,
      "label": "Prefix",
      "status": "tested"
    },
    {
      "offset": 46,
      "width": 1,
      "label": "Seed",
      "status": "tested"
    },
    {
      "offset": 47,
      "width": 5,
      "label": "Generation",
      "status": "tested"
    },
    {
      "offset": 52,
      "width": 2,
      "label": "CRC16",
      "status": "known"
    }
  ],
  "notes": [
    "CRC16 covers bytes 2\u201351 and is stored high byte first at bytes 52\u201353.",
    "Seed = (2 \u00d7 (ID + 1)) & 255. Use the documented two-chain dispatch policy."
  ],
  "checksum": {
    "kind": "CRC16-CCITT/FALSE",
    "start_byte": 2,
    "byte_count": 50
  }
}
