{
  "schema": "openminer-diagram-v1",
  "kind": "packet",
  "title": "BM2382 address assignment",
  "description": "BM2382 address assignment. Assign selectors 00,02,\u2026,b6 in the supported startup order. CRC5 covers bytes 2\u20135. Validate the subsequent identity inventories.",
  "unit": "byte",
  "width": 7,
  "numbering": "zero-based wire offset",
  "fields": [
    {
      "offset": 0,
      "width": 2,
      "label": "55 aa",
      "status": "known"
    },
    {
      "offset": 2,
      "width": 1,
      "label": "40",
      "status": "known"
    },
    {
      "offset": 3,
      "width": 1,
      "label": "05",
      "status": "known"
    },
    {
      "offset": 4,
      "width": 1,
      "label": "Selector",
      "status": "known"
    },
    {
      "offset": 5,
      "width": 1,
      "label": "00",
      "status": "known"
    },
    {
      "offset": 6,
      "width": 1,
      "label": "CRC5",
      "status": "known"
    }
  ],
  "notes": [
    "Assign selectors 00,02,\u2026,b6 in the supported startup order.",
    "CRC5 covers bytes 2\u20135. Validate the subsequent identity inventories."
  ],
  "checksum": {
    "kind": "CRC5",
    "start_byte": 2,
    "bit_count": 32
  }
}
