{
  "schema": "openminer-diagram-v1",
  "kind": "register",
  "title": "BM2382 CORE 0x02 \u00b7 Core configuration and output filter",
  "description": "BM2382 CORE 0x02 \u00b7 Core configuration and output filter. Bits 6\u20130 retained isolated changes. The 25\u219227\u219225 recipe changed selected output filtering. The universal score law and internal filter/queue order remain unknown.",
  "unit": "bit",
  "width": 24,
  "numbering": "least-significant bit is 0",
  "fields": [
    {
      "offset": 0,
      "width": 7,
      "label": "Retained changes",
      "status": "tested"
    },
    {
      "offset": 7,
      "width": 17,
      "label": "Unknown",
      "status": "unknown"
    }
  ],
  "notes": [
    "Bits 6\u20130 retained isolated changes. The 25\u219227\u219225 recipe changed selected output filtering.",
    "The universal score law and internal filter/queue order remain unknown."
  ]
}
